author,reply,timestamp,reply_url,comments,tweet_url,in_reply_to_user,match_id,team_handle
@adriaanse73,Waar is de Strijd. Passie. Trots. van ons RKC??,2024-10-26 20:42:00+00:00,https://nitter.net/adriaanse73/status/1850276810908418168#m,0,https://nitter.net/RKCWAALWIJK/status/1850276001302900981,@RKCWAALWIJK,M027,@RKCWAALWIJK
@Pimmio01608,"Geen vuist te maken, heb niet eens een pinkje gezien. Wat was dat tegenvallend zeg ! 0 vertrouwen, 0 plan klopt helemaal niks van",2024-10-27 08:33:00+00:00,https://nitter.net/Pimmio01608/status/1850455734103704008#m,0,https://nitter.net/RKCWAALWIJK/status/1850276001302900981,@RKCWAALWIJK,M027,@RKCWAALWIJK
@__Joepel,En dan Ihattaren brengen 😂,2024-10-26 20:35:00+00:00,https://nitter.net/__Joepel/status/1850275102891614570#m,0,https://nitter.net/RKCWAALWIJK/status/1850249270445670569,@RKCWAALWIJK,M027,@RKCWAALWIJK
@gjpruijssers,Hoezo is dit geen rood? De VAR kijkt er zelfs nog naar maar laat het gewoon gaan 😳,2024-10-26 18:34:00+00:00,https://nitter.net/gjpruijssers/status/1850244653683036465#m,1,https://nitter.net/RKCWAALWIJK/status/1850243948020744421,@RKCWAALWIJK,M027,@RKCWAALWIJK
@berisaha,Dat had dus gewoon rood moeten zijn blijkt uit de herhaling.,2024-10-26 18:32:00+00:00,https://nitter.net/berisaha/status/1850244137393774836#m,0,https://nitter.net/RKCWAALWIJK/status/1850243948020744421,@RKCWAALWIJK,M027,@RKCWAALWIJK
