author,reply,timestamp,comments,tweet_url,parent_reply_url,in_reply_to_author,parent_reply_text,match_id,team_handle
@Afca020446730,Bedankt Farioli,2024-12-08 15:27:00+00:00,0,https://nitter.net/AFCAjax/status/1865779383685816468,https://nitter.net/AjaxNewsZone/status/1865779723558871389#m,@AjaxNewsZone,"Bedankt voor een middag om je kapot te schamen, selectie EN staf 😡",M040_AFCAjax,@AFCAjax
@Afca020446730,"Je verwacht het niet, vd boomen en Berghuis & Akpom op de flanken 🤣😭",2024-12-08 15:28:00+00:00,1,https://nitter.net/AFCAjax/status/1865779383685816468,https://nitter.net/H0lyFarioli/status/1865780047233126457#m,@H0lyFarioli,"Deze nederlaag op het conto van Farioli… 
NOOIT MEER van den Boomen…",M040_AFCAjax,@AFCAjax
@H0lyFarioli,😭,2024-12-08 15:30:00+00:00,0,https://nitter.net/AFCAjax/status/1865779383685816468,https://nitter.net/H0lyFarioli/status/1865780047233126457#m,@H0lyFarioli,"Deze nederlaag op het conto van Farioli… 
NOOIT MEER van den Boomen…",M040_AFCAjax,@AFCAjax
@mhcrb68,Nou weet ik niet.  Maar deze starting lineup uit tegen az was vragen om problemen.,2024-12-08 15:31:00+00:00,0,https://nitter.net/AFCAjax/status/1865779383685816468,https://nitter.net/H0lyFarioli/status/1865780047233126457#m,@H0lyFarioli,"Deze nederlaag op het conto van Farioli… 
NOOIT MEER van den Boomen…",M040_AFCAjax,@AFCAjax
@BeukeringBg,En Berghuis,2024-12-08 19:43:00+00:00,0,https://nitter.net/AFCAjax/status/1865779383685816468,https://nitter.net/H0lyFarioli/status/1865780047233126457#m,@H0lyFarioli,"Deze nederlaag op het conto van Farioli… 
NOOIT MEER van den Boomen…",M040_AFCAjax,@AFCAjax
@Mikrafca,Ja joh en als Henderson dan nog erger geblesseerd was geraakt zat die ook fout. Altijd makkelijk praten achteraf,2024-12-08 15:29:00+00:00,1,https://nitter.net/AFCAjax/status/1865779383685816468,https://nitter.net/xajaxgirll020/status/1865779705275679108#m,@xajaxgirll020,BEGIN NOU GODVERDOMME EENS EEN KEER MET JE FUCKING BESTE 11. JE BESTE 11 IS AL KUT LAAT STAAN JE FUCKING WISSELS,M040_AFCAjax,@AFCAjax
@xajaxgirll020,"Dit had ik je vooraf ook al kunnen zeggen schat. Maar dan moest ik weer niet zo overdrijven. Tegen az start je met je sterkste 11, tegen Almere kan je wel een beetje rouleren",2024-12-08 15:34:00+00:00,1,https://nitter.net/AFCAjax/status/1865779383685816468,https://nitter.net/xajaxgirll020/status/1865779705275679108#m,@xajaxgirll020,BEGIN NOU GODVERDOMME EENS EEN KEER MET JE FUCKING BESTE 11. JE BESTE 11 IS AL KUT LAAT STAAN JE FUCKING WISSELS,M040_AFCAjax,@AFCAjax
@xajaxgirll020,Ik snap ook wel dat je teveel speelt maar tegen az begin je gewoon met je sterkste 11. Tegen Almere kan je er wel 5 op de bank zetten maar dit slaat gewoon nergens op,2024-12-08 15:28:00+00:00,2,https://nitter.net/AFCAjax/status/1865779383685816468,https://nitter.net/xajaxgirll020/status/1865779705275679108#m,@xajaxgirll020,BEGIN NOU GODVERDOMME EENS EEN KEER MET JE FUCKING BESTE 11. JE BESTE 11 IS AL KUT LAAT STAAN JE FUCKING WISSELS,M040_AFCAjax,@AFCAjax
@Afca020446730,Maar de beste spelers zaten op de bank? Dit is Farioli aan te rekenen met zn italiaanse rotkop,2024-12-08 15:27:00+00:00,0,https://nitter.net/AFCAjax/status/1865779383685816468,https://nitter.net/F1Daniel_/status/1865779844664918272#m,@F1Daniel_,"Met dank aan onze TD hebben we een elftal dat valt of staat met een 19 jarige linksbuiten

lekker man",M040_AFCAjax,@AFCAjax
@yannickneon,Gewoon beginnen met je sterkste 11,2024-12-08 15:25:00+00:00,1,https://nitter.net/AFCAjax/status/1865779383685816468,https://nitter.net/markiequarkie/status/1865779537570607471#m,@markiequarkie,"Zonde mannen , winterstop komt 2 weken te laat",M040_AFCAjax,@AFCAjax
@markiequarkie,"Tot een bepaalde hoogte met je eens , maar met de selectie die je hebt kunnen we bepaalde verliezen nog niet opvangen dus snap het wel",2024-12-08 15:31:00+00:00,1,https://nitter.net/AFCAjax/status/1865779383685816468,https://nitter.net/markiequarkie/status/1865779537570607471#m,@markiequarkie,"Zonde mannen , winterstop komt 2 weken te laat",M040_AFCAjax,@AFCAjax
@Afca020446730,"alsof dit aan conditie lag, Farioli heeft een Tia gehad",2024-12-08 15:29:00+00:00,1,https://nitter.net/AFCAjax/status/1865779383685816468,https://nitter.net/markiequarkie/status/1865779537570607471#m,@markiequarkie,"Zonde mannen , winterstop komt 2 weken te laat",M040_AFCAjax,@AFCAjax
@markiequarkie,"Iedereen geeft 110 % tegen Ajax , en het zal me niks verbazen als Az tegen NAC weer punten laat liggen . We zijn met Farioli op de goede weg . 1 of 2 goede aankopen in de winter en je doet gewoon mee voor plek 2 tot 4 na de winterstop . Wie had dat gedacht na vorig jaar ?",2024-12-08 15:33:00+00:00,1,https://nitter.net/AFCAjax/status/1865779383685816468,https://nitter.net/markiequarkie/status/1865779537570607471#m,@markiequarkie,"Zonde mannen , winterstop komt 2 weken te laat",M040_AFCAjax,@AFCAjax
@AFCA6419,Huh ? 🤔,2024-12-08 15:52:00+00:00,0,https://nitter.net/AFCAjax/status/1865779383685816468,https://nitter.net/Matjemat/status/1865780946303136142#m,@Matjemat,Wat een kneuzen bij dat teletekst,M040_AFCAjax,@AFCAjax
@PatrickG1976,Was dat maar waar….,2024-12-08 15:54:00+00:00,0,https://nitter.net/AFCAjax/status/1865779383685816468,https://nitter.net/Matjemat/status/1865780946303136142#m,@Matjemat,Wat een kneuzen bij dat teletekst,M040_AFCAjax,@AFCAjax
@lietjerietje,😹 NOS zo kansloos,2024-12-08 16:44:00+00:00,0,https://nitter.net/AFCAjax/status/1865779383685816468,https://nitter.net/Matjemat/status/1865780946303136142#m,@Matjemat,Wat een kneuzen bij dat teletekst,M040_AFCAjax,@AFCAjax
@Magnetic0_0,Die zijn ze vandaag al kwijt als Utrecht wint.,2024-12-08 15:31:00+00:00,1,https://nitter.net/AFCAjax/status/1865779383685816468,https://nitter.net/ajacied072/status/1865781164843163709#m,@ajacied072,"Compleet op jezelf afgeroepen en door veel Ajacieden voorspeld bij het zien van de opstelling. De bal is geen 30 seconden in de ploeg gebleven en je begint een bagger voorhoede. 
2e plaats ga je nog voor de winterstop kwijtraken.",M040_AFCAjax,@AFCAjax
@ajacied072,"Zeker. 

Maar ben overtuigd dat Maduro voor 1x dit seizoen een goed strijdplan neerzet en het een gelijkspel gaat worden.",2024-12-08 15:46:00+00:00,1,https://nitter.net/AFCAjax/status/1865779383685816468,https://nitter.net/ajacied072/status/1865781164843163709#m,@ajacied072,"Compleet op jezelf afgeroepen en door veel Ajacieden voorspeld bij het zien van de opstelling. De bal is geen 30 seconden in de ploeg gebleven en je begint een bagger voorhoede. 
2e plaats ga je nog voor de winterstop kwijtraken.",M040_AFCAjax,@AFCAjax
@Bastolie65,Vd Boomen en Rasmussen zijn oprecht waardeloos voor dit Ajax Akpom als supersub zou ik nog houden,2024-12-08 15:36:00+00:00,1,https://nitter.net/AFCAjax/status/1865779383685816468,https://nitter.net/Vector4020/status/1865781435996483702#m,@Vector4020,"Akpom verkopen, Gaaei weg, Rasmussen weg, Berghuis weg, van de Boomen weg. Haal 2-3 spelers en probeer meer met spelers als Mokio het te doen, want deze selectie kan je niet mee aan komen zetten in de top 3",M040_AFCAjax,@AFCAjax
@Vector4020,"Nee, als je daar 8-10m voor kan krijgen zie ik ze liever een jongere speler die bij Ajax past halen.",2024-12-08 15:37:00+00:00,1,https://nitter.net/AFCAjax/status/1865779383685816468,https://nitter.net/Vector4020/status/1865781435996483702#m,@Vector4020,"Akpom verkopen, Gaaei weg, Rasmussen weg, Berghuis weg, van de Boomen weg. Haal 2-3 spelers en probeer meer met spelers als Mokio het te doen, want deze selectie kan je niet mee aan komen zetten in de top 3",M040_AFCAjax,@AFCAjax
@BruynTony,Sutalo and Baas are awful as well--I saw the Utrect game--other than Hato--the backline is leakyweaky,2024-12-08 16:58:00+00:00,0,https://nitter.net/AFCAjax/status/1865779383685816468,https://nitter.net/Vector4020/status/1865781435996483702#m,@Vector4020,"Akpom verkopen, Gaaei weg, Rasmussen weg, Berghuis weg, van de Boomen weg. Haal 2-3 spelers en probeer meer met spelers als Mokio het te doen, want deze selectie kan je niet mee aan komen zetten in de top 3",M040_AFCAjax,@AFCAjax
@JaydenAjacied,Hou toch je smoel man,2024-12-08 15:25:00+00:00,2,https://nitter.net/AFCAjax/status/1865779383685816468,https://nitter.net/Damsterdam8991/status/1865779453688778802#m,@Damsterdam8991,Farioli out,M040_AFCAjax,@AFCAjax
@Damsterdam8991,3 kansen gecreëerd in 3 wedstrijden,2024-12-08 15:32:00+00:00,2,https://nitter.net/AFCAjax/status/1865779383685816468,https://nitter.net/Damsterdam8991/status/1865779453688778802#m,@Damsterdam8991,Farioli out,M040_AFCAjax,@AFCAjax
@afca_donny,clown,2024-12-08 15:24:00+00:00,0,https://nitter.net/AFCAjax/status/1865779383685816468,https://nitter.net/Damsterdam8991/status/1865779453688778802#m,@Damsterdam8991,Farioli out,M040_AFCAjax,@AFCAjax
@jay999_NGGE,Homo,2024-12-08 15:25:00+00:00,0,https://nitter.net/AFCAjax/status/1865779383685816468,https://nitter.net/Damsterdam8991/status/1865779453688778802#m,@Damsterdam8991,Farioli out,M040_AFCAjax,@AFCAjax
@jaydengamer06,En hzo dan de selectie mist gewoon teveel kwaliteit dat in combinatie met de blessures maakt het sowieso al onmogelijk om iets neer te zetten en dan beginnen we nog niet over de scheidsrechters want die zijn een nog grotere tegenstander dan de ploeg waar we tegen moeten,2024-12-08 15:59:00+00:00,0,https://nitter.net/AFCAjax/status/1865779383685816468,https://nitter.net/Damsterdam8991/status/1865779453688778802#m,@Damsterdam8991,Farioli out,M040_AFCAjax,@AFCAjax
@Mijnstijn,Brobbey,2024-12-08 15:26:00+00:00,1,https://nitter.net/AFCAjax/status/1865779383685816468,https://nitter.net/Jordi_AFC/status/1865779788125970818#m,@Jordi_AFC,Iedereen behalve Godts mag zich schamen,M040_AFCAjax,@AFCAjax
@Jordi_AFC,Voorruit dan maar.,2024-12-08 15:31:00+00:00,0,https://nitter.net/AFCAjax/status/1865779383685816468,https://nitter.net/Jordi_AFC/status/1865779788125970818#m,@Jordi_AFC,Iedereen behalve Godts mag zich schamen,M040_AFCAjax,@AFCAjax
@MirandaMaarssen,Tot een maand of 3 geleden had ik je zo genadeloos uitgelachen hierom....,2024-12-08 15:37:00+00:00,0,https://nitter.net/AFCAjax/status/1865775846188851243,https://nitter.net/ajacied072/status/1865781595103257065#m,@ajacied072,Zonder deze man is Ajax echt compleet verloren.,M040_AFCAjax,@AFCAjax
@kievit_daa35944,"Deze moeten we altijd hebben Laren 
Echte Ajacied",2024-12-08 17:16:00+00:00,0,https://nitter.net/AFCAjax/status/1865775846188851243,https://nitter.net/ajacied072/status/1865781595103257065#m,@ajacied072,Zonder deze man is Ajax echt compleet verloren.,M040_AFCAjax,@AFCAjax
@Afca020446730,Mag wat meer Israelische spirit in,2024-12-08 15:12:00+00:00,0,https://nitter.net/AFCAjax/status/1865775846188851243,https://nitter.net/streaupwafel/status/1865775945497395510#m,@streaupwafel,Mag iets enthousiaster,M040_AFCAjax,@AFCAjax
@pandabeer_2022,Is net flink geblesseerd geweest. Voorzichtig aan doen...,2024-12-08 15:44:00+00:00,0,https://nitter.net/AFCAjax/status/1865775846188851243,https://nitter.net/ferdypoelman/status/1865780818691637520#m,@ferdypoelman,Gewoon lekker 20minuten laten spelen goed bezig trainer farioli,M040_AFCAjax,@AFCAjax
@kievit_daa35944,Geef maar een hinkeltje van k3,2024-12-08 17:17:00+00:00,0,https://nitter.net/AFCAjax/status/1865775846188851243,https://nitter.net/kievit_daa35944/status/1865807594842997042#m,@kievit_daa35944,Branco van den boomen gaaei akpom wegbrengen naar de vuilnisbelt,M040_AFCAjax,@AFCAjax
@MarksLars,"Letterlijk sinds hij uitviel( waren we de betere tegen twente) is het fors minder geworden. Die hele negatieve vibe is langs hem heen gegaan. Laat hem please het verschil maken tegen lazio. Vertrouwen terug, almere daarna slopen..ritme,vertrouwen, vastigheid",2024-12-09 09:11:00+00:00,0,https://nitter.net/AFCAjax/status/1865775846188851243,https://nitter.net/roy_ajax1900/status/1865830042175205574#m,@roy_ajax1900,We zijn zo bizar afhankelijk van dit ventje...,M040_AFCAjax,@AFCAjax
@Markietenduivel,"Sukkeltje, ja is niet best wat ie doet deze wedstrijd maar farioli out slaat natuurlijk helemaal nergens op",2024-12-08 15:12:00+00:00,1,https://nitter.net/AFCAjax/status/1865774956040134996,https://nitter.net/H0lyFarioli/status/1865775263042179318#m,@H0lyFarioli,"Farioli out… als je van den Boomen 90 minuten laat staan moet je eruit.. 
ik had hoop op HOLY Farioli.. helaas… 😔",M040_AFCAjax,@AFCAjax
@H0lyFarioli,"Deze wedstrijd? 🤣😭
Boomen heeft nog nooit wat goed gedaan… en als je m een keer een kans geeft tegen Telstar… prima.. maar niet in deze.. en zeker geen 90min",2024-12-08 15:15:00+00:00,1,https://nitter.net/AFCAjax/status/1865774956040134996,https://nitter.net/H0lyFarioli/status/1865775263042179318#m,@H0lyFarioli,"Farioli out… als je van den Boomen 90 minuten laat staan moet je eruit.. 
ik had hoop op HOLY Farioli.. helaas… 😔",M040_AFCAjax,@AFCAjax
@Afca020446730,Farioli zn kanker pizza familie met dat rouleren,2024-12-08 15:10:00+00:00,0,https://nitter.net/AFCAjax/status/1865774510072344878,https://nitter.net/OBA_OBA1/status/1865774677559267703#m,@OBA_OBA1,Kankerteam,M040_AFCAjax,@AFCAjax
@AjaxkampioenXXX,Europa league is het laatste waar je nu op moet focussen,2024-12-08 15:06:00+00:00,1,https://nitter.net/AFCAjax/status/1865774510072344878,https://nitter.net/thxmaszn/status/1865774738032955836#m,@thxmaszn,Donderdag Lazio☠️,M040_AFCAjax,@AFCAjax
@thxmaszn,Bedoel meer als we zo donderdag spelen,2024-12-08 15:11:00+00:00,0,https://nitter.net/AFCAjax/status/1865774510072344878,https://nitter.net/thxmaszn/status/1865774738032955836#m,@thxmaszn,Donderdag Lazio☠️,M040_AFCAjax,@AFCAjax
@LarsStavenuiter,dat niet maar wel een slechte keuze om spelers zo veel te switchen.... je kunt nooit een team bouwen op deze manier.,2024-12-08 14:56:00+00:00,1,https://nitter.net/AFCAjax/status/1865771653600293063,https://nitter.net/fifavolgen/status/1865772068555636859#m,@fifavolgen,Iedereen die nu haat op farioli kan de tering krijgen🤫,M040_AFCAjax,@AFCAjax
@fifavolgen,Hij heeft toch alle data etc. We kunnen niet zomaar oordelen over waarom hij dit doet,2024-12-08 15:50:00+00:00,0,https://nitter.net/AFCAjax/status/1865771653600293063,https://nitter.net/fifavolgen/status/1865772068555636859#m,@fifavolgen,Iedereen die nu haat op farioli kan de tering krijgen🤫,M040_AFCAjax,@AFCAjax
@M38817262,Stoer hoor. Poeh poeh,2024-12-08 14:56:00+00:00,0,https://nitter.net/AFCAjax/status/1865771653600293063,https://nitter.net/fifavolgen/status/1865772068555636859#m,@fifavolgen,Iedereen die nu haat op farioli kan de tering krijgen🤫,M040_AFCAjax,@AFCAjax
@Kev2000_NL,Baas is sowieso de laatste weken heel slordig…,2024-12-08 14:54:00+00:00,2,https://nitter.net/AFCAjax/status/1865771653600293063,https://nitter.net/H0lyFarioli/status/1865771887222993080#m,@H0lyFarioli,"Prutsers! Wedero
 Baas met kut pass.. van de boomen uur te laat… 
Tyfus team…",M040_AFCAjax,@AFCAjax
@H0lyFarioli,Jep.. sinds ie meer gaat verdienen is t mager geworden.,2024-12-08 14:55:00+00:00,0,https://nitter.net/AFCAjax/status/1865771653600293063,https://nitter.net/H0lyFarioli/status/1865771887222993080#m,@H0lyFarioli,"Prutsers! Wedero
 Baas met kut pass.. van de boomen uur te laat… 
Tyfus team…",M040_AFCAjax,@AFCAjax
@Vector4020,Tering kneus,2024-12-08 14:55:00+00:00,0,https://nitter.net/AFCAjax/status/1865771653600293063,https://nitter.net/xajaxgirll020/status/1865771937865286007#m,@xajaxgirll020,#FarioliOUT leuke vent waardeloze opstelling elke week weer,M040_AFCAjax,@AFCAjax
@MikeJari,🤡,2024-12-08 16:15:00+00:00,0,https://nitter.net/AFCAjax/status/1865771653600293063,https://nitter.net/xajaxgirll020/status/1865771937865286007#m,@xajaxgirll020,#FarioliOUT leuke vent waardeloze opstelling elke week weer,M040_AFCAjax,@AFCAjax
@dodoai12,Eindelijk traore. Berghuis werkt niet hard en probeert eigen. spel te spelen. Je bent geen van persie 😂 #ajax,2024-12-08 14:53:00+00:00,0,https://nitter.net/AFCAjax/status/1865771129387778103,https://nitter.net/AFCAjax/status/1865771129387778103#m,@AFCAjax,,M040_AFCAjax,@AFCAjax
@dodoai12,Eindelijk traore. Berghuis werkt niet hard en probeert eigen. spel te spelen. Je bent geen van persie 😂 #ajax,2024-12-08 14:53:00+00:00,0,https://nitter.net/AFCAjax/status/1865771126653169711,https://nitter.net/AFCAjax/status/1865771129387778103#m,@AFCAjax,,M040_AFCAjax,@AFCAjax
@Rubiomonstro,"Wat zeg jij nou weer man, alsof het aan de scheids ligt",2024-12-08 14:29:00+00:00,0,https://nitter.net/AFCAjax/status/1865762882698334486,https://nitter.net/Ajaxdamsconews/status/1865763360068809047#m,@Ajaxdamsconews,Hoeveel wedstrijden hebben we nou al die scheidsrechters tegen ons gehad,M040_AFCAjax,@AFCAjax
@dewessies,"Zoek de problemen bij je eigen team en geef niet steeds iemand anders de schuld, zo goed zijn jullie tegenwoordig niet.",2024-12-08 14:35:00+00:00,0,https://nitter.net/AFCAjax/status/1865762882698334486,https://nitter.net/Ajaxdamsconews/status/1865763360068809047#m,@Ajaxdamsconews,Hoeveel wedstrijden hebben we nou al die scheidsrechters tegen ons gehad,M040_AFCAjax,@AFCAjax
@dewessies,"alweer door de bodem aan het zakken?
Het gaat van kwaad tot erger en dat met deze toptrainer.",2024-12-08 14:36:00+00:00,1,https://nitter.net/AFCAjax/status/1865762882698334486,https://nitter.net/BramS96_/status/1865763050218762372#m,@BramS96_,Slechtse helft ooit die ik van Ajax heb gezien na Salzburg uit.. En ik overdrijf niet,M040_AFCAjax,@AFCAjax
@dewessies,tis nix en het wordt nix.,2024-12-08 14:38:00+00:00,0,https://nitter.net/AFCAjax/status/1865762882698334486,https://nitter.net/OBA_OBA1/status/1865763171119628676#m,@OBA_OBA1,0 snelheid 0 diepgang 0 creativiteit🔥🔥,M040_AFCAjax,@AFCAjax
@dewessies,is het misschien Ajax (av) wat we aan het werk zien?,2024-12-08 14:37:00+00:00,0,https://nitter.net/AFCAjax/status/1865762882698334486,https://nitter.net/perryman1967/status/1865765065443389896#m,@perryman1967,"Te veel eer om dit Ajax1 te noemen, wat een armoede dit,en wat wil onze trainer nou bewijzen met dit middenveld??",M040_AFCAjax,@AFCAjax
@MPoelie14,De laatste van vandaag,2024-12-08 13:14:00+00:00,0,https://nitter.net/AFCAjax/status/1865745667190120723,https://nitter.net/Wim_G/status/1865745725537345773#m,@Wim_G,Branco in volle sprint,M040_AFCAjax,@AFCAjax
@tahadonnie,😭,2024-12-08 18:51:00+00:00,1,https://nitter.net/AFCAjax/status/1865734820619534617,https://nitter.net/SuperAjax0/status/1865735116766802083#m,@SuperAjax0,Win plz don't bottle again,M040_AFCAjax,@AFCAjax
@SuperAjax0,Allez allez supprime,2024-12-08 19:07:00+00:00,0,https://nitter.net/AFCAjax/status/1865734820619534617,https://nitter.net/SuperAjax0/status/1865735116766802083#m,@SuperAjax0,Win plz don't bottle again,M040_AFCAjax,@AFCAjax
@winterstop2024,"Berghuis op rechtsbuiten ❌
Branco op 6 ❌
Allemaal het gevolg van een onevenwichtige selectie ( gebrek aan gelijkwaardige buitenspelers,rechtsback en 6 positie ) en een wedstrijd elke 3 dagen.
Speelt Traore niet heb je alleen Berghuis.
#Ajax .",2024-12-08 12:27:00+00:00,2,https://nitter.net/AFCAjax/status/1865732214220284273,https://nitter.net/AjaxTotaalnl/status/1865732518294454486#m,@AjaxTotaalnl,Van den Boomen in de basis. Wordt drie puntenverlies.,M040_AFCAjax,@AFCAjax
@NielsAhob2,En Berghuis…,2024-12-08 12:19:00+00:00,0,https://nitter.net/AFCAjax/status/1865732214220284273,https://nitter.net/AjaxTotaalnl/status/1865732518294454486#m,@AjaxTotaalnl,Van den Boomen in de basis. Wordt drie puntenverlies.,M040_AFCAjax,@AFCAjax
@WATTVOI,Vreemde keuzes weer idd...,2024-12-08 12:20:00+00:00,0,https://nitter.net/AFCAjax/status/1865732214220284273,https://nitter.net/AjaxTotaalnl/status/1865732518294454486#m,@AjaxTotaalnl,Van den Boomen in de basis. Wordt drie puntenverlies.,M040_AFCAjax,@AFCAjax
@ThePlaymaker_14,Hoe heeft die nog niet door dat die man totaal ongeschikt is? Dit middenveld liep voor geen meter tegen NEC maar zal wel tegen AZ werken? Waanzinnig.,2024-12-08 12:23:00+00:00,1,https://nitter.net/AFCAjax/status/1865732214220284273,https://nitter.net/AjaxTotaalnl/status/1865732518294454486#m,@AjaxTotaalnl,Van den Boomen in de basis. Wordt drie puntenverlies.,M040_AFCAjax,@AFCAjax
@2903Mjc,Bluuuurrrhhhh,2024-12-08 13:16:00+00:00,0,https://nitter.net/AFCAjax/status/1865732214220284273,https://nitter.net/AjaxTotaalnl/status/1865732518294454486#m,@AjaxTotaalnl,Van den Boomen in de basis. Wordt drie puntenverlies.,M040_AFCAjax,@AFCAjax
@weijden_ter,"Branco statisch beste optie

Beste middenvelders dit seizoen

BOVENGEMIDDELD
Klaassen 7,27
Van den Boomen 7,21
Henderson 7,15
Taylor 7,14 ⏪

GEMIDDELD 7,06
Ajax Eredivisie seizoen 24/25

ONDERGEMIDDELD
Hlynsson 7,00 ⏪
Mannsverk 7,00
Berghuis 6,87
Fitz Jim 6,74 ⏪
Tahirović 6,30",2024-12-08 12:58:00+00:00,0,https://nitter.net/AFCAjax/status/1865732214220284273,https://nitter.net/roy_ajax1900/status/1865732734012076174#m,@roy_ajax1900,Pleur toch eens een eind op met die verschrikkelijke van den Boomen. Stel dan maar iemand van de ukkies op,M040_AFCAjax,@AFCAjax
@weijden_ter,"Branco statisch beste optie

Beste middenvelders dit seizoen

BOVENGEMIDDELD
Klaassen 7,27
Van den Boomen 7,21
Henderson 7,15
Taylor 7,14 ⏪

GEMIDDELD 7,06
Ajax Eredivisie seizoen 24/25

ONDERGEMIDDELD
Hlynsson 7,00 ⏪
Mannsverk 7,00
Berghuis 6,87
Fitz Jim 6,74 ⏪
Tahirović 6,30",2024-12-08 13:04:00+00:00,0,https://nitter.net/AFCAjax/status/1865732214220284273,https://nitter.net/Damsterdam8991/status/1865732389399306672#m,@Damsterdam8991,Sorry maar gebruik Lazio dan om te rouleren,M040_AFCAjax,@AFCAjax
@weijden_ter,"Branco statisch beste optie

Beste middenvelders dit seizoen

BOVENGEMIDDELD
Klaassen 7,27
Van den Boomen 7,21
Henderson 7,15
Taylor 7,14 ⏪

GEMIDDELD 7,06
Ajax Eredivisie seizoen 24/25

ONDERGEMIDDELD
Hlynsson 7,00 ⏪
Mannsverk 7,00
Berghuis 6,87
Fitz Jim 6,74 ⏪
Tahirović 6,30",2024-12-08 13:04:00+00:00,0,https://nitter.net/AFCAjax/status/1865732214220284273,https://nitter.net/Kev2000_NL/status/1865733270685577550#m,@Kev2000_NL,Bruh Van den Boomen😭,M040_AFCAjax,@AFCAjax
@sam101871,Omdat de trainer het belang van ‘iedereen bij de groep houden’ bizar overdrijft.,2024-12-08 12:24:00+00:00,0,https://nitter.net/AFCAjax/status/1865732214220284273,https://nitter.net/wilhemuh/status/1865733729974399126#m,@wilhemuh,"Vraag me dan toch af hoe een Hato, Sutalo en Baas alles kunnen spelen maar de rest moet steeds gerouleerd worden",M040_AFCAjax,@AFCAjax
@burgde2e,Wat dacht je van dat spelers die 4.5 mil p jaar verdienen gewoon 3x op rij kunnen spelen. Hoe deed Henderson dit in Engeland dan? Is dit zijn broer? En dan de traagste speler aller tijden als vervanger. Hier gaat je 2e plek,2024-12-08 12:37:00+00:00,1,https://nitter.net/AFCAjax/status/1865732214220284273,https://nitter.net/Ryan_H2000/status/1865732550959718488#m,@Ryan_H2000,"Dit gaat een pittige zit worden, had dan Lazio als rouleerwedstrijd gebruikt",M040_AFCAjax,@AFCAjax
@weijden_ter,"Branco statisch beste optie

Beste middenvelders dit seizoen

BOVENGEMIDDELD
Klaassen 7,27
Van den Boomen 7,21
Henderson 7,15
Taylor 7,14 ⏪

GEMIDDELD 7,06
Ajax Eredivisie seizoen 24/25

ONDERGEMIDDELD
Hlynsson 7,00 ⏪
Mannsverk 7,00
Berghuis 6,87
Fitz Jim 6,74 ⏪
Tahirović 6,30",2024-12-08 13:05:00+00:00,1,https://nitter.net/AFCAjax/status/1865732214220284273,https://nitter.net/JoeyVizual/status/1865733215626899605#m,@JoeyVizual,Van den Boomen 🥴,M040_AFCAjax,@AFCAjax
@JoeyVizual,Leuk die scores. Maar je kan me niet wijs maken dat Branco beter is dan Henderson en Taylor. Die score is ook minder representatief omdat Branco veel minder minuten heeft gemaakt (omdat hij niet zo goed is),2024-12-08 13:13:00+00:00,0,https://nitter.net/AFCAjax/status/1865732214220284273,https://nitter.net/JoeyVizual/status/1865733215626899605#m,@JoeyVizual,Van den Boomen 🥴,M040_AFCAjax,@AFCAjax
@weijden_ter,"Branco statisch beste optie

Beste middenvelders dit seizoen

BOVENGEMIDDELD
Klaassen 7,27
Van den Boomen 7,21
Henderson 7,15
Taylor 7,14 ⏪

GEMIDDELD 7,06
Ajax Eredivisie seizoen 24/25

ONDERGEMIDDELD
Hlynsson 7,00 ⏪
Mannsverk 7,00
Berghuis 6,87
Fitz Jim 6,74 ⏪
Tahirović 6,30",2024-12-08 13:05:00+00:00,0,https://nitter.net/AFCAjax/status/1865732214220284273,https://nitter.net/travellerincorp/status/1865734002432201086#m,@travellerincorp,Je wilt niet winnen he?,M040_AFCAjax,@AFCAjax
@sam101871,Van den Boomen en Berghuis weer rechtsbuiten is schandalig.,2024-12-08 12:25:00+00:00,0,https://nitter.net/AFCAjax/status/1865731991418896493,https://nitter.net/GrintaRosa/status/1865732195446313098#m,@GrintaRosa,Farioli is de weg kwijt,M040_AFCAjax,@AFCAjax
@chandue1,Waardeloze aankopen die miljoenen kosten.,2024-12-08 14:34:00+00:00,0,https://nitter.net/AFCAjax/status/1865731991418896493,https://nitter.net/DylannAFCA/status/1865732203239354802#m,@DylannAFCA,man man man,M040_AFCAjax,@AFCAjax
@kalecisizfb,as a ajax fan i want him back please bring him,2024-12-07 19:04:00+00:00,1,https://nitter.net/AFCAjax/status/1865413778851901580,https://nitter.net/jaydenbahceli/status/1865472228617277766#m,@jaydenbahceli,"We need Dusan Tadic. He makes key passes, crosses the ball and is handsome. His contract expires at the end of the season, our legend must return to the club!!!🤍❤️",M040_AFCAjax,@AFCAjax
@jaydenbahceli,aggressor tadiç🥵🥵🥵,2024-12-07 19:04:00+00:00,0,https://nitter.net/AFCAjax/status/1865413778851901580,https://nitter.net/jaydenbahceli/status/1865472228617277766#m,@jaydenbahceli,"We need Dusan Tadic. He makes key passes, crosses the ball and is handsome. His contract expires at the end of the season, our legend must return to the club!!!🤍❤️",M040_AFCAjax,@AFCAjax
