author,reply,timestamp,comments,tweet_url,parent_reply_url,in_reply_to_author,parent_reply_text,match_id,team_handle
@AjaxFancare,"Hi Bart, kan je per DM jouw gegevens met ons delen? Kijken we even met je mee.",2025-03-16 13:09:00+00:00,1,https://nitter.net/AFCAjax/status/1901159999336026520,https://nitter.net/Bartdevries3010/status/1901220596584792497#m,@Bartdevries3010,Heb het shirt besteld maar nog steeds geen bevestigingsmail met track and trace @AjaxFancare,M071_AFCAjax,@AFCAjax
@Bartdevries3010,Zeker heb een dm gestuurd,2025-03-16 13:16:00+00:00,0,https://nitter.net/AFCAjax/status/1901159999336026520,https://nitter.net/Bartdevries3010/status/1901220596584792497#m,@Bartdevries3010,Heb het shirt besteld maar nog steeds geen bevestigingsmail met track and trace @AjaxFancare,M071_AFCAjax,@AFCAjax
@M_achiel_tje,3 times nothing.,2025-03-16 12:28:00+00:00,0,https://nitter.net/AFCAjax/status/1901159999336026520,https://nitter.net/lennydabruce/status/1901188073792459243#m,@lennydabruce,& what exactly does the XXX symbolise?,M071_AFCAjax,@AFCAjax
@M_achiel_tje,GAY!!,2025-03-16 12:42:00+00:00,0,https://nitter.net/AFCAjax/status/1901159999336026520,https://nitter.net/jwroderic/status/1901183851344347157#m,@jwroderic,#ajaaz wtf Ajax.,M071_AFCAjax,@AFCAjax
@RoanBezemer,Goes is geschorst.,2025-03-15 22:30:00+00:00,1,https://nitter.net/AFCAjax/status/1901010514307932662,https://nitter.net/mvd_l27/status/1901028625216119019#m,@mvd_l27,Goes zal de hele middag wel aan dat shirt hangen,M071_AFCAjax,@AFCAjax
